{
  "type": "resource.changed",
  "schemaVersion": 1,
  "eventId": "77777777-7777-4777-8777-777777777777",
  "cursor": "cursor-00000043",
  "organizationId": "11111111-1111-4111-8111-111111111111",
  "resourceType": "work_item",
  "resourceId": "66666666-6666-4666-8666-666666666666",
  "changeKind": "updated",
  "version": 3,
  "occurredAt": "2026-07-15T10:45:00Z"
}
